<?xml version="1.0" encoding="UTF-8"?>
<!--
  ///////////////////////////////////////////////////////////////////////////////////////////// 
  // Authors:  Gero Decker, Oliver Kopp
  // Created: 6 Dec 2006
  // Last modified: $Date: 2007-04-30 17:35:22 +0200 (Mo, 30 Apr 2007) $
  // Purpose: Topology for ...
  ///////////////////////////////////////////////////////////////////////////////////////////// 
-->
<topology name="Px1_topology" 
    targetNamespace="http://example.com/service-interaction-patterns/x1"
    xmlns="urn:HPI_IAAS:choreography:schemas:choreography:topology:2006/12"
    xmlns:chordef="http://example.com/service-interaction-patterns/x1"
    xmlns:xsi="http://www.w3.org/2001/XMLSchema-instance"
    xsi:schemaLocation="urn:HPI_IAAS:choreography:schemas:choreography:topology:2006/12 http://www.iaas.uni-stuttgart.de/schemas/bpel4chor/topology.xsd">

  <participantTypes>
    <participantType name="AuctioningService" participantBehaviorDescription="chordef:x1_A" processLanguage="urn:HPI_IAAS:choreography:profile:2006/12" />
    <participantType name="Bidder" participantBehaviorDescription="chordef:x1_B" processLanguage="urn:HPI_IAAS:choreography:profile:2006/12" />
  </participantTypes>

  <participants>
    <participant name="a" type="AuctioningService" />
    <participantSet name="bidders" type="Bidder">
      <participantSet name="acceptedBidders" type="Bidder" forEach="fe1">
        <participant name="b" type="Bidder" forEach="fe1" />
      </participantSet>
    </participantSet>
  </participants>

  <messageLinks>
    <messageLink senders="bidders" sendActivities="sendBid" bindSenderTo="acceptedBidders" receiver="a" receiveActivity="receiveBid" messageName="bid" />
    <messageLink sender="a" sendActivity="sendAnswer" receiver="b" receiveActivity="receiveAnswer" messageName="answer" />
  </messageLinks>

</topology>