<?xml version="1.0" encoding="UTF-8"?>
<!--
  ///////////////////////////////////////////////////////////////////////////////////////////// 
  // Authors:  Gero Decker, Oliver Kopp
  // Created: 6 Dec 2006
  // Last modified: $Date: 2007-05-03 15:25:20 +0200 (Do, 03 Mai 2007) $
  // Purpose: Topology for the multi responses pattern
  ///////////////////////////////////////////////////////////////////////////////////////////// 
-->
<topology name="P08_topology" 
    targetNamespace="http://example.com/service-interaction-patterns/08"
    xmlns="urn:HPI_IAAS:choreography:schemas:choreography:topology:2006/12"
    xmlns:chordef="http://example.com/service-interaction-patterns/08"
    xmlns:xsi="http://www.w3.org/2001/XMLSchema-instance"
    xsi:schemaLocation="urn:HPI_IAAS:choreography:schemas:choreography:topology:2006/12 http://www.iaas.uni-stuttgart.de/schemas/bpel4chor/topology.xsd">

  <participantTypes>
    <participantType name="A" participantBehaviorDescription="chordef:A" />
    <participantType name="B" participantBehaviorDescription="chordef:B" />
  </participantTypes>

  <participants>
    <participant name="a" type="A" />
    <participant name="b" type="B" />
  </participants>

  <messageLinks>
    <messageLink sender="a" sendActivity="sendRequest" receiver="b" receiveActivity="receiveRequest" messageName="request" />
    <messageLink sender="b" sendActivity="sendResponse" receiver="a" receiveActivity="receiveResponse" messageName="response" />
  </messageLinks>

</topology>
