<?xml version="1.0" encoding="UTF-8"?>
<!--
  ///////////////////////////////////////////////////////////////////////////////////////////// 
  // Authors:  Gero Decker, Oliver Kopp
  // Created: 6 Dec 2006
  // Last modified: $Date: 2007-04-30 17:35:22 +0200 (Mo, 30 Apr 2007) $
  // Purpose: Topology for the relayed request pattern
  ///////////////////////////////////////////////////////////////////////////////////////////// 
-->
<topology name="P12_servicetopology" 
    targetNamespace="http://example.com/service-interaction-patterns/12"
    xmlns="urn:HPI_IAAS:choreography:schemas:choreography:topology:2006/12"
    xmlns:chordef="http://example.com/service-interaction-patterns/12"
    xmlns:xsi="http://www.w3.org/2001/XMLSchema-instance"
    xsi:schemaLocation="urn:HPI_IAAS:choreography:schemas:choreography:topology:2006/12 http://www.iaas.uni-stuttgart.de/schemas/bpel4chor/topology.xsd">

  <participantTypes>
    <participantType name="Client" participantBehaviorDescription="chordef:C" processLanguage="urn:HPI_IAAS:choreography:profile:2006/12" />
    <participantType name="Government" participantBehaviorDescription="chordef:G" processLanguage="urn:HPI_IAAS:choreography:profile:2006/12" />
    <participantType name="ServiceProvider" participantBehaviorDescription="chordef:SP" processLanguage="urn:HPI_IAAS:choreography:profile:2006/12" />
  </participantTypes>

  <participants>
    <participant name="client" type="Client" />
    <participant name="gov" type="Government" selects="prov" />
    <participant name="prov" type="ServiceProvider" />
  </participants>

  <messageLinks>
    <messageLink sender="client" sendActivity="sendRequest" receiver="gov" receiveActivity="receiveRequest" messageName="request" />
    <messageLink sender="gov" sendActivity="delegateRequest" receiver="prov" receiveActivity="receiveRequest" messageName="request" participantRefs="client" />
    <messageLink sender="prov" sendActivity="sendReport" receiver="gov" receiveActivity="receiveReport" messageName="report" />
    <messageLink sender="prov" sendActivity="sendResponse" receiver="client" receiveActivity="receiveResponse" messageName="response" />
  </messageLinks>

</topology>
